{
  "$schema": "https://json-schema.org/draft/2020-12/schema",
  "$id": "architecture.schema.json",
  "title": "Architecture Artifact",
  "description": "Structured output of ai/architect-agent: the resolved graph of nodes this application will be composed from, plus stack choices.",
  "type": "object",
  "required": ["$schema", "artifactType", "version", "metadata", "data"],
  "properties": {
    "$schema": { "type": "string" },
    "artifactType": { "const": "architecture" },
    "version": { "type": "string", "pattern": "^\\d+\\.\\d+\\.\\d+$" },
    "metadata": { "$ref": "requirements.schema.json#/$defs/metadata" },
    "data": {
      "type": "object",
      "additionalProperties": false,
      "required": ["projectName", "stack", "nodes"],
      "properties": {
        "projectName": { "type": "string" },
        "stack": {
          "type": "object",
          "additionalProperties": false,
          "required": ["backend", "database", "storage"],
          "properties": {
            "backend": { "enum": ["express", "fastify", "nestjs"] },
            "frontend": { "enum": ["nextjs", "react", "none"] },
            "database": { "enum": ["neon-postgres", "postgres", "mysql"] },
            "storage": { "enum": ["aws-s3", "cloudflare-r2", "local", "none"] },
            "authentication": { "enum": ["jwt", "session", "oauth", "none"] },
            "authorization": { "enum": ["rbac", "none"] },
            "deployment": { "enum": ["docker", "serverless", "none"] }
          }
        },
        "nodes": {
          "type": "array",
          "description": "The resolved, ordered list of graph node ids this application will execute (see GRAPH-NODE-SPEC.md).",
          "items": {
            "type": "object",
            "additionalProperties": false,
            "required": ["id", "order"],
            "properties": {
              "id": { "type": "string", "description": "Dotted template id, e.g. backend.express.controller" },
              "order": { "type": "integer", "minimum": 0 },
              "inputs": { "type": "object" }
            }
          }
        },
        "edges": {
          "type": "array",
          "description": "Explicit node-to-node dependency edges beyond template.yaml requires/extends, for graph-specific composition choices.",
          "items": {
            "type": "object",
            "additionalProperties": false,
            "required": ["from", "to"],
            "properties": {
              "from": { "type": "string" },
              "to": { "type": "string" }
            }
          }
        }
      }
    }
  }
}
