{
  "$schema": "../../artifacts/architecture.schema.json",
  "artifactType": "architecture",
  "version": "1.0.0",
  "metadata": {
    "generatedBy": "ai.architect-agent",
    "generatedAt": "2026-02-03T09:00:00Z",
    "projectName": "multi-tenant-saas",
    "sourceArtifacts": ["requirements.json"]
  },
  "data": {
    "projectName": "multi-tenant-saas",
    "stack": {
      "backend": "express",
      "frontend": "nextjs",
      "database": "neon-postgres",
      "storage": "aws-s3",
      "authentication": "jwt",
      "authorization": "rbac",
      "deployment": "docker"
    },
    "nodes": [
      { "id": "project.node-express", "order": 0, "inputs": { "projectName": "multi-tenant-saas", "port": 3000, "corsOrigin": "https://app.example.com" } },
      { "id": "backend.error-handler", "order": 1, "inputs": {} },
      { "id": "backend.api-response", "order": 2, "inputs": {} },
      { "id": "backend.pagination", "order": 3, "inputs": { "defaultPageSize": 25, "maxPageSize": 100 } },
      { "id": "backend.middleware", "order": 4, "inputs": {} },
      { "id": "backend.validation", "order": 5, "inputs": {} },
      { "id": "database.neon-postgres.connection", "order": 6, "inputs": {} },
      { "id": "database.migrations", "order": 7, "inputs": {} },
      { "id": "database.transactions", "order": 8, "inputs": {} },
      { "id": "storage.aws-s3", "order": 9, "inputs": { "defaultBucketName": "saas-media" } },
      { "id": "storage.upload", "order": 10, "inputs": { "keyPrefix": "tenant-uploads" } },
      { "id": "storage.file-validation", "order": 11, "inputs": { "allowedMimeTypes": ["application/pdf", "image/png", "image/jpeg"], "maxSizeBytes": 10485760 } },
      { "id": "storage.presigned-url", "order": 12, "inputs": { "defaultExpirySeconds": 900, "maxExpirySeconds": 3600 } },
      { "id": "authentication.jwt", "order": 13, "inputs": { "accessTokenTtl": "15m", "refreshTokenTtlDays": 14 } },
      { "id": "authentication.password", "order": 14, "inputs": { "minPasswordLength": 12 } },
      { "id": "authorization.rbac", "order": 15, "inputs": {} },
      { "id": "authorization.tenant-isolation", "order": 16, "inputs": {} },
      { "id": "backend.repository", "order": 17, "inputs": { "entityName": "Project", "tableName": "projects", "fields": [
        { "name": "tenantId", "drizzleType": "uuid('tenant_id')", "notNull": true },
        { "name": "name", "drizzleType": "varchar('name', { length: 200 })", "notNull": true },
        { "name": "status", "drizzleType": "varchar('status', { length: 32 })", "notNull": true }
      ] } },
      { "id": "backend.service", "order": 18, "inputs": { "entityName": "Project" } },
      { "id": "backend.controller", "order": 19, "inputs": { "entityName": "Project" } },
      { "id": "backend.express", "order": 20, "inputs": { "entityName": "Project", "tableName": "projects", "requiresAuth": true } },
      { "id": "api.crud", "order": 21, "inputs": {
        "entityName": "Project", "tableName": "projects",
        "fields": [
          { "name": "tenantId", "drizzleType": "uuid('tenant_id')", "notNull": true },
          { "name": "name", "drizzleType": "varchar('name', { length: 200 })", "notNull": true },
          { "name": "status", "drizzleType": "varchar('status', { length: 32 })", "notNull": true }
        ],
        "filterableFields": ["status", "tenantId"], "sortableFields": ["name", "createdAt"], "requiresAuth": true
      } },
      { "id": "devops.docker", "order": 22, "inputs": {} },
      { "id": "devops.github-actions", "order": 23, "inputs": {} },
      { "id": "testing.unit", "order": 24, "inputs": {} },
      { "id": "testing.integration", "order": 25, "inputs": {} },
      { "id": "testing.api", "order": 26, "inputs": {} },
      { "id": "documentation.setup", "order": 27, "inputs": {} },
      { "id": "documentation.api", "order": 28, "inputs": {} },
      { "id": "documentation.architecture", "order": 29, "inputs": {} }
    ],
    "edges": [
      { "from": "api.crud", "to": "authorization.tenant-isolation" },
      { "from": "api.crud", "to": "authorization.rbac" },
      { "from": "authentication.password", "to": "authentication.jwt" },
      { "from": "storage.file-validation", "to": "storage.upload" },
      { "from": "storage.presigned-url", "to": "storage.aws-s3" }
    ]
  }
}
